,RepoID,IssueID,Title_Description,AST,FixedByID,Name,CreatedDate
6588,aspnetcoreWebScrap,1760,microsoft aspnet webapi client support xamarin io monodroid target hilook like microsoft aspnet webapi client nuget packag compat xamarin io monodroid project tri add packag use vs xamarin studio packag manag give error could instal packag microsoft aspnet webapi client tri instal packag project target xamarin iosvers packag contain assembl refer content file compat framework inform contact packag author packag manag vs less strict valid allow instal packag xamarin io monodroid project ad refer assembl lib portabl wp netcor net wp wpa system net http format dll compil run correctli would make sens updat packag support xamarin target properli probabl ad monoandroid monotouch xamarin io enough thank youalexey,,unknown,unknown,2016-09-20
6589,aspnetcoreWebScrap,1762,unabl find view use convent base rout area creat folder name area creat folder name account insid folder area account control model view creat accountcontrol area account control creat folder name account area account view ad loginview cshtml area account view account previous tri area account view accountcontrol follow method displaylogin method correctli rout doesnt work add attribut base rout well convent base want use convent base anyway set breakpoint see displaylogin call accountcontrol class follow returnedan unhandl except occur process request invalidoperationexcept view loginview found follow locat search view account loginview cshtml view share loginview cshtml,<bm>configure|routesvoidpredefinedtype|methoddeclaration|parameterlist|parameter|identifiernamei|route|buildervoidpredefinedtype|methoddeclaration|parameterlist|parameterroute|buildervoidpredefinedtype|methoddeclarationmethod_namei|route|builderidentifiername|parameterroute|builderi|route|builderidentifiername|parameter|parameterlist|methoddeclarationmethod_nameroute|builderparameter|parameterlist|methoddeclaration|block|expressionstatement|invocationexpression|simplememberaccessexpression0|identifiername1map|routeroute|builderidentifiername0|simplememberaccessexpression|identifiername1map|routeroute|builderparameter|parameterlist|methoddeclaration|block|expressionstatement|invocationexpression|simplememberaccessexpression0|identifiername1map|routeroute|builderidentifiername0|simplememberaccessexpression|identifiername1map|routeroute|builderparameter|parameterlist|methoddeclaration|block|expressionstatement|invocationexpression|simplememberaccessexpression0|identifiername1map|routeroute|builderidentifiername0|simplememberaccessexpression|identifiername1map|routeroute|builderidentifiername0|simplememberaccessexpression0|invocationexpression|argumentlist1|argument0|stringliteralexpressionarea|routeroute|builderidentifiername0|simplememberaccessexpression0|invocationexpression|argumentlist1|argument1|stringliteralexpressionareaexistscontrolleractionroute|builderidentifiername0|simplememberaccessexpression0|invocationexpression|argumentlist1|argument0|stringliteralexpressionarea|route|with|idroute|builderidentifiername0|simplememberaccessexpression0|invocationexpression|argumentlist1|argument1|stringliteralexpressionareaexistscontrolleractionidroute|builderidentifiername0|simplememberaccessexpression0|invocationexpression|argumentlist1|argument0|stringliteralexpressiondefaultroute|builderidentifiername0|simplememberaccessexpression0|invocationexpression|argumentlist1|argument1|stringliteralexpressioncontrollerhomeactionindexidroute|builderparameter|parameterlist|methoddeclarationmethod_nameroute|builderidentifiername0|simplememberaccessexpression0|invocationexpression|expressionstatement|block|methoddeclarationmethod_nameroute|builderidentifiername0|simplememberaccessexpression0|invocationexpression|expressionstatement|block|methoddeclarationmethod_nameroute|builderidentifiername0|simplememberaccessexpression0|invocationexpression|expressionstatement|block|methoddeclarationmethod_namemap|routeidentifiername1|simplememberaccessexpression0|invocationexpression|argumentlist1|argument0|stringliteralexpressionarea|routemap|routeidentifiername1|simplememberaccessexpression0|invocationexpression|argumentlist1|argument1|stringliteralexpressionareaexistscontrolleractionmap|routeidentifiername1|simplememberaccessexpression0|invocationexpression|argumentlist1|argument0|stringliteralexpressionarea|route|with|idmap|routeidentifiername1|simplememberaccessexpression0|invocationexpression|argumentlist1|argument1|stringliteralexpressionareaexistscontrolleractionidmap|routeidentifiername1|simplememberaccessexpression0|invocationexpression|argumentlist1|argument0|stringliteralexpressiondefaultmap|routeidentifiername1|simplememberaccessexpression0|invocationexpression|argumentlist1|argument1|stringliteralexpressioncontrollerhomeactionindexidmap|routeidentifiername1|simplememberaccessexpression0|invocationexpression|expressionstatement|block|methoddeclarationmethod_namemap|routeidentifiername1|simplememberaccessexpression0|invocationexpression|expressionstatement|block|methoddeclarationmethod_namemap|routeidentifiername1|simplememberaccessexpression0|invocationexpression|expressionstatement|block|methoddeclarationmethod_namearea|routestringliteralexpression|argument0|argumentlist|argument1|stringliteralexpressionareaexistscontrolleractionarea|routestringliteralexpression|argument0|argumentlist1|invocationexpression|expressionstatement|block|methoddeclarationmethod_nameareaexistscontrolleractionstringliteralexpression|argument1|argumentlist1|invocationexpression|expressionstatement|block|methoddeclarationmethod_namearea|route|with|idstringliteralexpression|argument0|argumentlist|argument1|stringliteralexpressionareaexistscontrolleractionidarea|route|with|idstringliteralexpression|argument0|argumentlist1|invocationexpression|expressionstatement|block|methoddeclarationmethod_nameareaexistscontrolleractionidstringliteralexpression|argument1|argumentlist1|invocationexpression|expressionstatement|block|methoddeclarationmethod_namedefaultstringliteralexpression|argument0|argumentlist|argument1|stringliteralexpressioncontrollerhomeactionindexiddefaultstringliteralexpression|argument0|argumentlist1|invocationexpression|expressionstatement|block|methoddeclarationmethod_namecontrollerhomeactionindexidstringliteralexpression|argument1|argumentlist1|invocationexpression|expressionstatement|block|methoddeclarationmethod_nameroute|builderidentifiername0|simplememberaccessexpression0|invocationexpression|expressionstatement|block|methoddeclaration|parameterlist|parameterroute|builderroute|builderidentifiername0|simplememberaccessexpression0|invocationexpression|expressionstatement|block|methoddeclaration|parameterlist|parameterroute|builderroute|builderidentifiername0|simplememberaccessexpression0|invocationexpression|expressionstatement|block|methoddeclaration|parameterlist|parameterroute|builderroute|builderparameter|parameterlist|methoddeclaration|block|expressionstatement|invocationexpression|simplememberaccessexpression0|identifiername0route|builderroute|builderparameter|parameterlist|methoddeclaration|block|expressionstatement|invocationexpression|simplememberaccessexpression0|identifiername0route|builderroute|builderparameter|parameterlist|methoddeclaration|block|expressionstatement|invocationexpression|simplememberaccessexpression0|identifiername0route|builder<em>,unknown,question,2016-09-21
6590,aspnetcoreWebScrap,1763,cert revok download microsoft com cert revok tri download someth download microsoft com cant even instal visual studio tool aspnet core sinc onlin download site tri manual download compon via ie edg show error neterr cert revok btw china disabl cert check internet option work problem microsoft certif problem own,,unknown,unknown,2016-09-21
6592,aspnetcoreWebScrap,1765,test asp net core built ilogg want verifi log log use asp net core built ilogg inject asp net core built di privat readonli ilogg invoiceapi logger throw invalid verifi non virtual overrid vb member logerrorso verifi log log ask answer got need wrap ilogg interfac sure main object ilogg wrapper log itll better testabl thank,,unknown,unknown,2016-09-21
6591,aspnetcoreWebScrap,1764,load ssr report net core requir need load ssr report net core web applic work use web refer net framework option net core pleas advis option thank much,,unknown,unknown,2016-09-21
6593,aspnetcoreWebScrap,1766,fatalexecutionengineerror window anniversari updat instal window anniversari updat instal ii sinc updat remov unabl run local develop websit ii whenev attempt access local dev websit browser see follow img width alt screen shot src event log see correspond error like follow log name applic sourc applic error date event id task categori level error keyword classic user comput danielklein descript fault applic name wp exe version time stamp fault modul name clr dll version time stamp except code xc fault offset fault process id fault applic start time ea ede fault applic path window system inetsrv wp exe fault modul path window microsoft net framework clr dll report id bcc fb aa fa fe fault packag full name fault packag rel applic id event xmlfurthermor debug one web site watch debugg make applic start fine immedi thereaft except thrown origin thought relat tri instal repair net core well repair vs avail complet loss help workaround would greatli appreci go roll back prior anniversari updat,,unknown,unknown,2016-09-22
6595,aspnetcoreWebScrap,1768,html textareafor valid execut server side helloin applic use textarea data bound requir properti viewmodel html textareafor stringvalu new id controlid html validationmessagefor stringvalu automat jqueri unobtrus valid work fine howev post valid form modelst valid textarea control validationstatu unvalid assum bug also textboxfor control page server side valid work fine look like valid miss control would realli appreci short comment issu thank advanceleonard,,unknown,unknown,2016-09-23
6594,aspnetcoreWebScrap,1767,wcf servic unabl net wcf servic unabl net show netstandard support asp net,,unknown,unknown,2016-09-23
6596,aspnetcoreWebScrap,1770,dnu restor fail linux vm build docker imag hii problem start project linux vm docker instal im difficult time build imag aspnet project json webroot wwwroot version depend microsoft aspnet server ii rc final microsoft aspnet server weblisten rc final microsoft aspnet mvc rc final microsoft aspnet server kestrel rc final command web microsoft aspnet host server microsoft aspnet server weblisten server url kestrel microsoft aspnet server kestrel server kestrel server url framework dnx dnxcore publishexclud node modul bower compon xproj user vspscc exclud wwwroot node modul bower compon dockerfil microsoft aspnet rc final coreclradd src appworkdir apprun dnu restor expos env lastrefresh error get start command docker build aspnetbas error findpackagesbyid microsoft aspnet server ii http request time exit restor faileda task cancel feed use command dnu restor return non zero code help pleas davidfowl,,unknown,unknown,2016-09-27
6597,aspnetcoreWebScrap,1771,memorypoolhttpresponsestreamwriterfactori throw argumentnullexcept hii except thrown aspnet code abl reproduc sistematicallydo idea caus issu thank advanc,<bm>getstringpredefinedtype|typeargumentlist|genericnamei|enumerablestringpredefinedtype|arraytype|arraycreationexpression|arrayinitializerexpression|stringliteralexpressionentitystringpredefinedtype|arraytype|arraycreationexpression|arrayinitializerexpression|stringliteralexpressionentitystringpredefinedtype|typeargumentlist|genericname|methoddeclarationmethod_namestringpredefinedtype|arraytype|arraycreationexpression|returnstatement|block|methoddeclarationmethod_namei|enumerablegenericname|methoddeclarationmethod_nameentitystringliteralexpression|arrayinitializerexpression|stringliteralexpressionentityentitystringliteralexpression|arrayinitializerexpression|arraycreationexpression|returnstatement|block|methoddeclarationmethod_nameentitystringliteralexpression|arrayinitializerexpression|arraycreationexpression|returnstatement|block|methoddeclarationmethod_name<em>,unknown,unknown,2016-09-28
319,aspnetcoreWebScrap,1772,bind http net core hibeen tri figur im tri bind ii net core app ill get found type address fine use im hope someon ran help thank much,,unknown,unknown,2016-09-29
336,aspnetcoreWebScrap,1774,aspnet cdn doesnt serv gzip content file check davidfowl compress compress compress compressedthi quit big penalti file btw right place report issu,,unknown,unknown,2016-09-30
329,aspnetcoreWebScrap,1773,hide sourc code hii possibl hide web applic sourc code publish instal like web applic need instal everi client like ii one server like normal websit sourc code visibl,,unknown,unknown,2016-09-30
95,aspnetcoreWebScrap,1295,dnx cmd process termin due inact helloi host asp net applic ii brows applic first time browser see start new process dnx cmd conhost understand first request sent web cmd get execut httprequesthandl pass request listen localhostport ii issu experienc activ come ii dnx cmd conhost process get termin understand probabl normal behavior howev increas respons time applic sec dnx cmd conhost process run way keep dnx cmd conhost process run also tri applic initi ii keep applic pool run time dnx cmd conhost process termin activ come dnx,,unknown,unknown,2016-10-02
88,aspnetcoreWebScrap,1294,support cento organ plan develop next big project net core deploy linux support ubuntu one thing keen know target support core clr cento anyon tell cento support roadmap,,unknown,unknown,2016-10-02
83,aspnetcoreWebScrap,1293,debug sourc ive tri figur run debug sourc found inform seem work found old blog entri dosent seem work sourc call project global json seem noth chang enter local src better resourc debug run sourc thank theo,,unknown,unknown,2016-10-02
4576,aspnetcoreWebScrap,1347,could get remot ip address rc window connect properti httpcontext null tri get ihttpconnectionfeatur return null window tri thing window work fine remot ip address ipv dont want like also tri rc ip address correctli return sinc still lot bug rc use rc pleas solv bug soon possibl stuck issu long time,,unknown,unknown,2016-10-03
