,RepoID,IssueID,Title_Description,AST,FixedByID,Name,CreatedDate
1910,aspnetcoreWebScrap,1380,renam project json dotnet json sinc new tool dotnet last chanc renam gener name project json dotnet json interest think project json gener name dotnet specif project file contain identifi insid mean project json project spread ide tool go insid gener name file see dotnet project project json propos dotnet json good exampl tsconfig json typescript confus tool,,unknown,unknown,2016-07-04
6416,aspnetcoreWebScrap,1428,add system runtim compilerservic unsaf feed isnt current present feedha improv,,unknown,unknown,2016-07-05
3798,aspnetcoreWebScrap,1553,roadmap document data look like document asp net core roadmap date rc alreadi releas still plan june,,unknown,unknown,2016-07-06
3814,aspnetcoreWebScrap,1555,project json publishopt map work properli rc bug hiim sure post im tri understand map work publishopt project json includ sampl reason includ extra dummi part path get extra file folder includ publishim run ps command root repo dotnet publish src publishfil temp net releas spent time mess around tri get folder includ publish output folder seem way get includ rel path think like doesnt work map extrafil thanksdoug,,unknown,unknown,2016-07-06
3806,aspnetcoreWebScrap,1554,stuck convert rc code rc librarydescript rc use abl get assembl referenc particular assembl exampl assembl load assembl list like soin rc world librarymanag getreferencinglibrari thisassemblynam return enumer librarydescript oppos librari get assembl librarydescript order load api look drastic differ awar assembl replac call iassemblyloadcontextaccessor assembl load desktop clr assemblyloadcontext default load coreclr get assembl name path first place stuck,,unknown,unknown,2016-07-06
4730,aspnetcoreWebScrap,1737,static asset load consist hi host asp net core applic ii face challeng brows applic host static asset style java script file load get bad gateway occur inconsist also occur make browser refresh input would highli appreci kestrel,,unknown,unknown,2016-07-09
4731,aspnetcoreWebScrap,1738,kudu deploy longer run prepublish script gulp task rtm sure appropri repo report pleas direct appropri place abl find discuss issu project json contain followingthi alway ran gulp task fine pre rtm deploy kudu move project rtm gulp task longer execut kudu deploy therefor css minif etc happen build project within vs run task expect someth differ need,,unknown,unknown,2016-07-09
4729,aspnetcoreWebScrap,1736,nodeservic cant pipe result stream chain success callback cant seem pipe result stream success callbackwork fine local deploy azur get taskcancellationexcept exampl project reproduc live exampl full stacktrac miss someth obviou,,unknown,unknown,2016-07-09
5172,aspnetcoreWebScrap,4993,wrong pars color comment razor file inlin tag javiercn decemb repro step creat razor file past follow content first comment color green second one red blue style list stylenon list style typenon ul class list inlin list unstyl style list stylenon list style typenon copi origin issu aspnet tool,,unknown,area-mvc| bug| feature-razor-pages,2016-07-12
3064,aspnetcoreWebScrap,1864,system environ variabl read server asp net core websit work fine local use environ variabl store environ coupl connect string problem local deploy websit server via releas manag xcopi powershel script run administr appropri variabl creat updat server confirm start websit get follow return log start environ report product dont know come aspnetcor environ dev dont use term product anywher code dbl check use term prd even updat default templat code use uatprd instead stage product place appear layout cshtml etc rais stackoverflow question outlin detail issu appear system environ variabl complet ignor thought initi may permiss issu chang applic pool ii run still anyon point direct look issu respond clarifi setup,,unknown,unknown,2016-07-12
3074,aspnetcoreWebScrap,1867,possibl type equal bug use gener oper deseri titl possibl type equal bug use gener oper deseri scenario implement iequalitycompar simplifi life test work fine compar deseri version object function impact oper behav deseri serial involv comparison two valu use oper without serial involv consist minim repro step creat full repro project includ workaround myclassequalitycompar alternateequ pleas note simplic sake myclassequalitycompar implement iequalitycompar sinc need minim repro step expect result method call compar equal return true sinc valu valu compar follow valu valu actual result result fals conclus hope right place bit hard figur repo gener issu post feel free point right way,,unknown,unknown,2016-07-12
3071,aspnetcoreWebScrap,1865,unabl use core asp net core web applic net framework creat new asp net core web applic net framework select web applic chang authent user account updat nuget packag run visual studio error fileloadexcept could load file assembl microsoft aspnetcor http featur version cultur neutral publickeytoken adb ddae one depend locat assembl manifest definit match assembl refer except hresult im run window vs updat,,unknown,unknown,2016-07-12
3073,aspnetcoreWebScrap,1866,compilationfailedexcept asp net core net framework visual studio rc repro error visual studio rc creat new asp net core web applic net framework project add code index cshtml error compilationfailedexcept type dictionari defin assembl referenc must add refer assembl system collect version cultur neutral publickeytoken dicterror except caus todictionari call complain know dictionari instanti empti dictionari first line work fine also happen razor cshtml code work regular class,<bm>mainvoidpredefinedtype|methoddeclaration|parameterlist|parameter|arraytype|predefinedtypestringvoidpredefinedtype|methoddeclaration|parameterlist|parameterargsvoidpredefinedtype|methoddeclarationmethod_namestringpredefinedtype|arraytype|parameterargsstringpredefinedtype|typeargumentlist|genericnamedictionarystringpredefinedtype|typeargumentlist|genericnamedictionarystringpredefinedtype|typeargumentlist|genericname|objectcreationexpression|equalsvalueclause|variabledeclarator|variabledeclaration|genericnamedictionarystringpredefinedtype|typeargumentlist|genericname|objectcreationexpression|equalsvalueclause|variabledeclarator|variabledeclaration|genericnamedictionarystringpredefinedtype|typeargumentlist|genericname|variabledeclaration|variabledeclarator|equalsvalueclause|objectcreationexpression|genericnamedictionarystringpredefinedtype|typeargumentlist|genericname|variabledeclaration|variabledeclarator|equalsvalueclause|objectcreationexpression|genericnamedictionarystringpredefinedtype|typeargumentlist|genericnamedictionarystringpredefinedtype|typeargumentlist|genericnamedictionarystringpredefinedtype|typeargumentlist|genericnamedictionarystringpredefinedtype|typeargumentlist|genericnamedictionarystringpredefinedtype|typeargumentlist|genericname|variabledeclaration|variabledeclaratorteststringpredefinedtype|typeargumentlist|genericname|variabledeclaration|variabledeclaratorteststringpredefinedtype|typeargumentlist|genericname|objectcreationexpression|equalsvalueclause|variabledeclaratorteststringpredefinedtype|typeargumentlist|genericname|objectcreationexpression|equalsvalueclause|variabledeclaratorteststringpredefinedtype|arraytype|arraycreationexpression|arrayinitializerexpression|stringliteralexpressionteststringpredefinedtype|arraytype|arraycreationexpression|equalsvalueclause|variabledeclaratorteststringpredefinedtype|typeargumentlist|genericname1|simplememberaccessexpression|identifiername0teststringpredefinedtype|typeargumentlist|genericname1|simplememberaccessexpression|identifiername0teststringpredefinedtype|typeargumentlist|genericnameto|dictionarystringpredefinedtype|typeargumentlist|genericnameto|dictionarystringpredefinedtype|typeargumentlist|genericname|variabledeclaration|variabledeclaratorteststringpredefinedtype|typeargumentlist|genericname|variabledeclaration|variabledeclaratorteststringpredefinedtype|typeargumentlist|genericname1|simplememberaccessexpression0|invocationexpression|equalsvalueclause|variabledeclaratorteststringpredefinedtype|typeargumentlist|genericname1|simplememberaccessexpression0|invocationexpression|equalsvalueclause|variabledeclaratorteststringpredefinedtype|arraytype|parameter|parameterlist|methoddeclarationmethod_namestringpredefinedtype|typeargumentlist|genericname|variabledeclaration|localdeclarationstatement|block|methoddeclarationmethod_namestringpredefinedtype|typeargumentlist|genericname|variabledeclaration|localdeclarationstatement|block|methoddeclarationmethod_namestringpredefinedtype|typeargumentlist|genericname|variabledeclaration|localdeclarationstatement|block|methoddeclarationmethod_namestringpredefinedtype|typeargumentlist|genericname|variabledeclaration|localdeclarationstatement|block|methoddeclarationmethod_nameargsparameter|parameterlist|methoddeclaration|block|localdeclarationstatement|variabledeclaration|genericnamedictionaryargsparameter|parameterlist|methoddeclaration|block|localdeclarationstatement|variabledeclaration|genericnamedictionaryargsparameter|parameterlist|methoddeclaration|block|localdeclarationstatement|variabledeclaration|variabledeclaratortestargsparameter|parameterlist|methoddeclaration|block|localdeclarationstatement|variabledeclaration|variabledeclaratortestargsparameter|parameterlist|methoddeclaration|block|localdeclarationstatement|variabledeclaration|variabledeclaratortestargsparameter|parameterlist|methoddeclarationmethod_namedictionarygenericname|variabledeclaration|variabledeclaratortestdictionarygenericname|objectcreationexpression|equalsvalueclause|variabledeclaratortestdictionarygenericname|variabledeclaration|localdeclarationstatement|block|localdeclarationstatement|variabledeclaration|variabledeclaratortestdictionarygenericname|variabledeclaration|localdeclarationstatement|block|localdeclarationstatement|variabledeclaration|variabledeclaratortestdictionarygenericname|variabledeclaration|variabledeclarator|equalsvalueclause|invocationexpression|simplememberaccessexpression0|identifiername0testdictionarygenericname|variabledeclaration|variabledeclarator|equalsvalueclause|invocationexpression|simplememberaccessexpression0|genericname1to|dictionarydictionarygenericname|variabledeclaration|variabledeclaratortestdictionarygenericname|variabledeclaration|localdeclarationstatement|block|methoddeclarationmethod_namedictionarygenericname|objectcreationexpression|equalsvalueclause|variabledeclarator|variabledeclaration|localdeclarationstatement|block|methoddeclarationmethod_namedictionarygenericname|variabledeclaration|localdeclarationstatement|block|methoddeclarationmethod_nametestvariabledeclarator|variabledeclaration|localdeclarationstatement|block|localdeclarationstatement|variabledeclaration|variabledeclaratortesttestvariabledeclarator|variabledeclaration|localdeclarationstatement|block|methoddeclarationmethod_nameteststringliteralexpression|arrayinitializerexpression|arraycreationexpression|equalsvalueclause|variabledeclaratortesttestidentifiername0|simplememberaccessexpression|genericname1to|dictionarytestidentifiername0|simplememberaccessexpression0|invocationexpression|argumentlist1|argument0|simplelambdaexpression|parameterxtestidentifiername0|simplememberaccessexpression0|invocationexpression|argumentlist1|argument0|simplelambdaexpression|identifiernamextestvariabledeclarator|variabledeclaration|localdeclarationstatement|block|localdeclarationstatement|variabledeclaration|variabledeclaratortesttestidentifiername0|simplememberaccessexpression0|invocationexpression|equalsvalueclause|variabledeclaratortesttestvariabledeclarator|variabledeclaration|localdeclarationstatement|block|methoddeclarationmethod_nameto|dictionarygenericname1|simplememberaccessexpression0|invocationexpression|argumentlist1|argument0|simplelambdaexpression|parameterxto|dictionarygenericname1|simplememberaccessexpression0|invocationexpression|argumentlist1|argument0|simplelambdaexpression|identifiernamexto|dictionarygenericname1|simplememberaccessexpression0|invocationexpression|equalsvalueclause|variabledeclaratortestxparameter|simplelambdaexpression|argument0|argumentlist1|invocationexpression|equalsvalueclause|variabledeclaratortestxidentifiername|simplelambdaexpression|argument0|argumentlist1|invocationexpression|equalsvalueclause|variabledeclaratortesttestvariabledeclarator|variabledeclaration|localdeclarationstatement|block|methoddeclarationmethod_namestringpredefinedtype|typeargumentlist|predefinedtypestringstringpredefinedtype|typeargumentlist|predefinedtypestringstringpredefinedtype|typeargumentlist|predefinedtypestringstringpredefinedtype|typeargumentlist|predefinedtypestringstringpredefinedtype|typeargumentlist|predefinedtypestringstringpredefinedtype|typeargumentlist|predefinedtypestringstringpredefinedtype|typeargumentlist|predefinedtypestringstringpredefinedtype|typeargumentlist|predefinedtypestringdictionarygenericname|objectcreationexpression|equalsvalueclause|variabledeclarator|variabledeclaration|genericnamedictionarydictionarygenericname|variabledeclaration|variabledeclarator|equalsvalueclause|objectcreationexpression|genericnamedictionaryxidentifiername|simplelambdaexpression|parameterxxparameter|simplelambdaexpression|identifiernamex<em>,unknown,unknown,2016-07-12
6331,aspnetcoreWebScrap,1287,sha manag net core hello tri convert code net core troubl convert code basic hash password use sha manag anyon pleas assist internet abl find old conflict inform guess make sens chang much constantli thank youus sha sham new sha manag userpassword password sham computehash encod utf getbyt saltedpassword,,unknown,discussion,2016-08-02
6338,aspnetcoreWebScrap,1288,asp net window authent integr helloi creat intranet applic window authent enabl enabl window authent ii abl access applic log user window tri restrict control allow specif user role access content look sever document onlin asp net older version use author user contoso rick contoso keith contoso mike exampl applic tri author role domain group name get forbidden error also check offici asp net document dont see document window authent user role base access also post issu stackoverflow sure commun help much suggest realli appreci,,blowdart,bug,2016-08-02
1925,aspnetcoreWebScrap,1382,run web app ubuntu via coreclr rc updat want setup cross platform work environ develop window via vs run ubuntu work well window kestrel fail run ubuntu execut commanddnu restor error msg like show fail download depenc lib dont know fix,,unknown,unknown,2016-08-04
2845,aspnetcoreWebScrap,1383,question plan rc chang plan rc debug tool visual studio rc detail,,unknown,unknown,2016-08-04
6419,aspnetcoreWebScrap,1429,recur task would like know best practic implement recur task asp net core cross platform way seem reason outsourc long run task separ app im especi interest trigger task asp net app cours could use establish task schedul solut variou target system simpl thing would much easier could simpli configur time app directli trigger extern app scott hanselman wrote use blog post base phil haack post point risk regard old asp netsom risk certainli continu exist least issu ii david fowler mention use iapplicationlifetim find app want shut remain question execut code certain point time app trigger task extern process found code use tpl task delay timespan fromminut countdown continuewith continuewith would simpli start extern app calcul next execut time case guess wouldnt necessari use iapplicationlifetim would grate hear opinion,,unknown,unknown,2016-08-05
3816,aspnetcoreWebScrap,1556,microsoft extens cach memori rc final doesnt support servic addcach revert depend back rc final provid definit servic addcach complain three depend conflict expect rc get rc microsoft aspnetcor mvcmicrosoft aspnetcor mvc razor host microsoft aspnetcor mvc taghelp,,unknown,unknown,2016-08-06
5552,aspnetcoreWebScrap,1560,sqlserver session except rc asp net core web applic net framework tri access session rc asp net core web applic net framework get except could load file assembl system collect nongener version cultur neutral publickeytoken one depend work rc asp net core web applic net core detail,<bm>indexvoidpredefinedtype|methoddeclarationmethod_namehttp|contextidentifiername0|simplememberaccessexpression|identifiername1sessionhttp|contextidentifiername0|simplememberaccessexpression0|simplememberaccessexpression|identifiername1set|stringhttp|contextidentifiername0|simplememberaccessexpression0|simplememberaccessexpression0|invocationexpression|argumentlist1|argument0|stringliteralexpressionhellohttp|contextidentifiername0|simplememberaccessexpression0|simplememberaccessexpression0|invocationexpression|argumentlist1|argument1|stringliteralexpressionworldhttp|contextidentifiername0|simplememberaccessexpression0|simplememberaccessexpression0|invocationexpression|expressionstatement|block|methoddeclarationmethod_namesessionidentifiername1|simplememberaccessexpression0|simplememberaccessexpression|identifiername1set|stringsessionidentifiername1|simplememberaccessexpression0|simplememberaccessexpression0|invocationexpression|argumentlist1|argument0|stringliteralexpressionhellosessionidentifiername1|simplememberaccessexpression0|simplememberaccessexpression0|invocationexpression|argumentlist1|argument1|stringliteralexpressionworldsessionidentifiername1|simplememberaccessexpression0|simplememberaccessexpression0|invocationexpression|expressionstatement|block|methoddeclarationmethod_nameset|stringidentifiername1|simplememberaccessexpression0|invocationexpression|argumentlist1|argument0|stringliteralexpressionhelloset|stringidentifiername1|simplememberaccessexpression0|invocationexpression|argumentlist1|argument1|stringliteralexpressionworldset|stringidentifiername1|simplememberaccessexpression0|invocationexpression|expressionstatement|block|returnstatement|invocationexpression|identifiername0viewset|stringidentifiername1|simplememberaccessexpression0|invocationexpression|expressionstatement|block|methoddeclarationmethod_namehellostringliteralexpression|argument0|argumentlist|argument1|stringliteralexpressionworldhellostringliteralexpression|argument0|argumentlist1|invocationexpression|expressionstatement|block|methoddeclarationmethod_nameworldstringliteralexpression|argument1|argumentlist1|invocationexpression|expressionstatement|block|methoddeclarationmethod_nameviewidentifiername0|invocationexpression|returnstatement|block|methoddeclarationmethod_nameexceptioncommentexception<em><bm>aboutvoidpredefinedtype|methoddeclarationmethod_nameview|dataidentifiername0|elementaccessexpression|bracketedargumentlist1|argument0|stringliteralexpressionmessageview|dataidentifiername0|elementaccessexpression0|simpleassignmentexpression|stringliteralexpression1your|application|description|pageview|dataidentifiername0|elementaccessexpression0|simpleassignmentexpression|expressionstatement|block|localdeclarationstatement|variabledeclaration|variabledeclaratorxview|dataidentifiername0|elementaccessexpression0|simpleassignmentexpression|expressionstatement|block|methoddeclarationmethod_namemessagestringliteralexpression|argument0|bracketedargumentlist1|elementaccessexpression0|simpleassignmentexpression|stringliteralexpression1your|application|description|pagemessagestringliteralexpression|argument0|bracketedargumentlist1|elementaccessexpression0|simpleassignmentexpression|expressionstatement|block|methoddeclarationmethod_nameyour|application|description|pagestringliteralexpression1|simpleassignmentexpression|expressionstatement|block|localdeclarationstatement|variabledeclaration|variabledeclaratorxyour|application|description|pagestringliteralexpression1|simpleassignmentexpression|expressionstatement|block|methoddeclarationmethod_namehttp|contextidentifiername0|simplememberaccessexpression|identifiername1sessionhttp|contextidentifiername0|simplememberaccessexpression0|simplememberaccessexpression|identifiername1get|stringhttp|contextidentifiername0|simplememberaccessexpression0|simplememberaccessexpression0|invocationexpression|argumentlist1|argument0|stringliteralexpressionhellohttp|contextidentifiername0|simplememberaccessexpression0|simplememberaccessexpression0|invocationexpression|equalsvalueclause|variabledeclaratorxsessionidentifiername1|simplememberaccessexpression0|simplememberaccessexpression|identifiername1get|stringsessionidentifiername1|simplememberaccessexpression0|simplememberaccessexpression0|invocationexpression|argumentlist1|argument0|stringliteralexpressionhellosessionidentifiername1|simplememberaccessexpression0|simplememberaccessexpression0|invocationexpression|equalsvalueclause|variabledeclaratorxget|stringidentifiername1|simplememberaccessexpression0|invocationexpression|argumentlist1|argument0|stringliteralexpressionhelloget|stringidentifiername1|simplememberaccessexpression0|invocationexpression|equalsvalueclause|variabledeclaratorxhellostringliteralexpression|argument0|argumentlist1|invocationexpression|equalsvalueclause|variabledeclaratorxxvariabledeclarator|variabledeclaration|localdeclarationstatement|block|returnstatement|invocationexpression|identifiername0viewxvariabledeclarator|variabledeclaration|localdeclarationstatement|block|methoddeclarationmethod_nameviewidentifiername0|invocationexpression|returnstatement|block|methoddeclarationmethod_nameexceptioncommentexception<em>,unknown,unknown,2016-08-06
4664,aspnetcoreWebScrap,1558,depend microsoft aspnet webapi client support framework netcoreapp version creat netcor consol applic use system net http sinc need includ code instal microsft aspnet webapi client depend use packag manag consol instal success encount error mention titl know need depend add support format content negoti system net http anyon help issu want add depend code found error httpcontent doesnot contain definit readasasync extens method readasasync accept first argument type httpcontent could found use respons content readasasync program cs,,unknown,unknown,2016-08-06
4675,aspnetcoreWebScrap,1559,could load type microsoft applicationinsight extens implement trace diagnosticslisten assembl microsoft applicationinsight version creat net core web applic tri run ubuntu help mono target framework face follow except unhandl except system typeloadexcept could load type microsoft applicationinsight extens implement trace diagnosticslisten assembl microsoft applicationinsight version cultur neutral publickeytoken bf ad microsoft aspnetcor host intern webhost initi filenam unknown microsoft aspnetcor host webhostbuild build fee filenam unknown socioboard program main system string arg home glb document socioboard src socioboard program cs error fatal unhandl except system typeloadexcept could load type microsoft applicationinsight extens implement trace diagnosticslisten assembl microsoft applicationinsight version cultur neutral publickeytoken bf ad microsoft aspnetcor host intern webhost initi filenam unknown microsoft aspnetcor host webhostbuild build fee filenam unknown project json depend microsoft applicationinsight aspnetcor rc final microsoft aspnetcor mvc rc final microsoft aspnetcor server iisintegr rc final microsoft aspnetcor server kestrel rc final microsoft extens configur environmentvari rc final microsoft extens configur fileextens rc final microsoft extens configur json rc final microsoft extens log rc final microsoft extens log consol rc final microsoft extens log debug rc final serilog rc serilog extens log rc serilog sink coloredconsol beta serilog sink rollingfil rc microsoft extens option configurationextens rc final microsoft extens option rc final mongodb bson mongodb driver mysql data mysql data entiti newtonsoft json nhibern linq stackexchang redi microsoft aspnetcor cor rc final tool microsoft aspnetcor server iisintegr tool version preview final import portabl net win dnxcore framework net frameworkassembl system xml depend nhibern buildopt emitentrypoint true preservecompilationcontext true runtimeopt gcserver true publishopt includ wwwroot view appset json web config script postpublish dotnet publish ii publish folder publishoutputpath framework publishfulltargetframework pleas help fix issu,,unknown,unknown,2016-08-06
4653,aspnetcoreWebScrap,1557,question implement oauth server asp net core web applic net core implement oauth server asp net core web applic net core,,unknown,unknown,2016-08-06
